{
    "$schema": "https://json-schema.org/draft/2020-12/schema",
    "type": "object",
    "required": [
        "attribute_set_id",
        "created_at",
        "custom_attributes",
        "extension_attributes",
        "id",
        "media_gallery_entries",
        "name",
        "options",
        "price",
        "product_links",
        "sku",
        "status",
        "tier_prices",
        "type_id",
        "updated_at",
        "visibility"
    ],
    "properties": {
        "id": {
            "type": "integer"
        },
        "sku": {
            "type": "string"
        },
        "name": {
            "type": "string"
        },
        "attribute_set_id": {
            "type": "integer"
        },
        "price": {
            "type": "integer"
        },
        "status": {
            "type": "integer"
        },
        "visibility": {
            "type": "integer"
        },
        "type_id": {
            "type": "string"
        },
        "created_at": {
            "type": "string"
        },
        "updated_at": {
            "type": "string"
        },
        "extension_attributes": {
            "type": "object",
            "required": [
                "website_ids"
            ],
            "properties": {
                "website_ids": {
                    "type": "array",
                    "items": {
                        "type": "integer"
                    }
                }
            }
        },
        "product_links": {
            "type": "array"
        },
        "options": {
            "type": "array"
        },
        "media_gallery_entries": {
            "type": "array"
        },
        "tier_prices": {
            "type": "array"
        },
        "custom_attributes": {
            "type": "array",
            "items": {
                "type": "object",
                "properties": {
                    "attribute_code": {
                        "type": "string"
                    },
                    "value": {
                        "anyOf": [
                            {
                                "type": "array"
                            },
                            {
                                "type": "string"
                            }
                        ]
                    }
                },
                "required": [
                    "attribute_code",
                    "value"
                ]
            }
        }
    }
}
