{
    "id": 753918,
    "sku": "153105",
    "name": "153105 SPEED HUMP YELLOW&BLACK 129X32.5X",
    "attribute_set_id": 458,
    "price": 91,
    "status": 2,
    "visibility": 3,
    "type_id": "simple",
    "created_at": "2024-11-12 00:30:32",
    "updated_at": "2024-11-12 00:30:32",
    "extension_attributes": {
        "website_ids": [
            1
        ]
    },
    "product_links": [
    ],
    "options": [
    ],
    "media_gallery_entries": [
    ],
    "tier_prices": [
    ],
    "custom_attributes": [
        {
            "attribute_code": "url_key",
            "value": "153105-speed-hump-yellow-black-129x32-5x"
        },
        {
            "attribute_code": "options_container",
            "value": "container2"
        },
        {
            "attribute_code": "description",
            "value": "Built from masterdata product record #585420"
        },
        {
            "attribute_code": "cost",
            "value": "77.040000"
        },
        {
            "attribute_code": "article_i_d",
            "value": "12511658"
        },
        {
            "attribute_code": "oms_department",
            "value": "11"
        },
        {
            "attribute_code": "oms_ffgroup",
            "value": "211"
        },
        {
            "attribute_code": "msrp_display_actual_price_type",
            "value": "0"
        },
        {
            "attribute_code": "barcode_gtin",
            "value": "8720287178521"
        },
        {
            "attribute_code": "product_staging",
            "value": "87306"
        },
        {
            "attribute_code": "required_options",
            "value": "0"
        },
        {
            "attribute_code": "has_options",
            "value": "0"
        },
        {
            "attribute_code": "tax_class_id",
            "value": "2"
        },
        {
            "attribute_code": "is_imported",
            "value": "1"
        },
        {
            "attribute_code": "is_googleshopping",
            "value": "1"
        },
        {
            "attribute_code": "category_ids",
            "value": [
            ]
        },
        {
            "attribute_code": "is_returnable",
            "value": "2"
        },
        {
            "attribute_code": "offer_type",
            "value": "87246"
        },
        {
            "attribute_code": "value_statement",
            "value": "67197,67201,67223"
        },
        {
            "attribute_code": "msg_availability",
            "value": "10341"
        },
        {
            "attribute_code": "msg_availability_type",
            "value": "35494"
        }
    ]
}
